"WQKA9BPK","journalArticle","2014","Shlens, Jonathon","A Tutorial on Principal Component Analysis","arXiv:1404.1100 [cs, stat]","","","","http://arxiv.org/abs/1404.1100","Principal component analysis (PCA) is a mainstay of modern data analysis - a black box that is widely used but (sometimes) poorly understood. The goal of this paper is to dispel the magic behind this black box. This manuscript focuses on building a solid intuition for how and why principal component analysis works. This manuscript crystallizes this knowledge by deriving from simple intuitions, the mathematics behind PCA. This tutorial does not shy away from explaining the ideas informally, nor does it shy away from the mathematics. The hope is that by addressing both aspects, readers of all levels will be able to gain a better understanding of PCA as well as the when, the how and the why of applying this technique.","2014-04-03","2021-03-16 14:08:59","2021-04-06 15:04:42","2021-03-16 14:08:59","","","","","","","","","","","","","","","","","","","arXiv.org","","arXiv: 1404.1100","<div data-schema-version=""1""><p>Annotation</p> <p>This paper introduces how the PCA works and how to apply the PCA into datasets. The PCA was invented in 1901, and is a transformation to a new space with smaller dimension by scalar projection. Take a low dimension (2D) dataset as an example, the PCA means transforming the dataset to a line (1D) which has the projection of the dataset with the highest variance. If the transformed dimension is larger than 1, the new axis is located with the highest variance of dataset projection in the orthogonal plane of other axises.</p> <p><br> </p></div>","F:\Google Drive - Monash\Bibliography\Shlens_2014_A Tutorial on Principal Component Analysis.pdf; C:\Users\smczx\Zotero\storage\CR8D93IJ\1404.html","","Unreviewed","Computer Science - Machine Learning; Statistics - Machine Learning","","","","","","","","","","","","","","","","","","","","","","","","","","","","","","","","","","","","","","","","","","","","","",""
"UPDBRJGH","journalArticle","1995","Cootes, T. F.; Taylor, C. J.; Cooper, D. H.; Graham, J.","Active Shape Models-Their Training and Application","Computer Vision and Image Understanding","","1077-3142","10.1006/cviu.1995.1004","https://www.sciencedirect.com/science/article/pii/S1077314285710041","Model-based vision is firmly established as a robust approach to recognizing and locating known rigid objects in the presence of noise, clutter, and occlusion. It is more problematic to apply model-based methods to images of objects whose appearance can vary, though a number of approaches based on the use of flexible templates have been proposed. The problem with existing methods is that they sacrifice model specificity in order to accommodate variability, thereby compromising robustness during image interpretation. We argue that a model should only be able to deform in ways characteristic of the class of objects it represents. We describe a method for building models by learning patterns of variability from a training set of correctly annotated images. These models can be used for image search in an iterative refinement algorithm analogous to that employed by Active Contour Models (Snakes). The key difference is that our Active Shape Models can only deform to fit the data in ways consistent with the training set. We show several practical examples where we have built such models and used them to locate partially occluded objects in noisy, cluttered images.","1995-01-01","2021-03-16 14:10:07","2021-03-16 14:10:07","2021-03-16 14:10:07","38-59","","1","61","","Computer Vision and Image Understanding","","","","","","","","en","","","","","ScienceDirect","","","<div data-schema-version=""1""><p>Annotation</p> <p>Active Shape Model (ASM)</p> <p>The problem of locating examples of known objects in images.</p> <p>The shape of the objects of same class may vary. Using flexible models or deformable templates can be used to allow for some degree of variability in the shape of the imaged objects.</p> <p>The method is to use mean template and a deformable transformation applied to point distribution model to fit the target shape. And the shape is constrained by PCA.</p> <p>The shapes of registers.</p> <p>No quantitative comparison with other methods.</p> <p>+ve: Low time and space complexity. Can be applied to a wide range of image interpretation tasks.</p> <p>-ve: Require annotations for training images. Not robust to noise, clutter and occlusion.</p> <p>A traditional method for shape fitting with the constrain of PCA and the training with transformation.</p></div>","F:\Google Drive - Monash\Bibliography\Cootes et al_1995_Active Shape Models-Their Training and Application.pdf; C:\Users\smczx\Zotero\storage\A9CBSJ67\S1077314285710041.html","","","","","","","","","","","","","","","","","","","","","","","","","","","","","","","","","","","","","","","","","","","","","","","","",""
"8NUJHIL5","journalArticle","2001","Cootes, T. F.; Edwards, G. J.; Taylor, C. J.","Active appearance models","IEEE Transactions on Pattern Analysis and Machine Intelligence","","1939-3539","10.1109/34.927467","","We describe a new method of matching statistical models of appearance to images. A set of model parameters control modes of shape and gray-level variation learned from a training set. We construct an efficient iterative matching algorithm by learning the relationship between perturbations in the model parameters and the induced image errors.","2001-06","2021-03-16 14:11:16","2021-04-08 05:27:36","","681-685","","6","23","","","","","","","","","","","","","","","IEEE Xplore","","Conference Name: IEEE Transactions on Pattern Analysis and Machine Intelligence","<div data-schema-version=""1""><p>Annotation</p> <p>Active Appearance Models (AAM)</p> <p>Previous methods are very slow or easily become trapped in local minima to fit photo-realistic appearance. Some previous methods cannot fit because the shape-normalized texture map cannot be reconstructed.</p> <p>The authors thought the hypothesis of the optimization problem is similar to each time so can be similarities offline, which can find the directions of rapid convergence.</p> <p>The AAM is a further improvement of ASM, which combining both the shape and texture for fitting the model.</p> <p>Datasets are 100 hand-labeled face images as training set and another 100 as test set.</p> <p>No quantitative comparison to other methods.</p> <p>+ve: Good reliability and robustness of image appearance search.</p> <p>-ve: The training speed of AAM is slower than ASM.</p> <p>The improvement of ASM combining the shape and texture.</p></div>","C:\Users\smczx\Zotero\storage\2Y22Q7QV\927467.html; F:\Google Drive - Monash\Bibliography\Cootes et al_2001_Active appearance models.pdf","","","active appearance models; Active shape model; Deformable models; deformable template; gray-level variation; Image generation; image matching; Image reconstruction; Image segmentation; image texture; Iterative algorithms; iterative method; iterative methods; learning; learning (artificial intelligence); model matching; optimisation; Optimization methods; Robustness; Shape control; shape matching; statistical analysis; statistical models; Surface fitting; texture matching","","","","","","","","","","","","","","","","","","","","","","","","","","","","","","","","","","","","","","","","","","","","","",""
"TFE7ABP5","report","2018","Rhue, Lauren","Racial Influence on Automated Perceptions of Emotions","","","","","https://papers.ssrn.com/abstract=3281765","The practical applications of artificial intelligence are expanding into various elements of society, leading to a growing interest in the potential biases of such algorithms. Facial analysis, one application of artificial intelligence, is increasingly used in real-word situations. For example, some organizations tell candidates to answer predefined questions in a recorded video and use facial recognition to analyze the potential applicant faces. In addition, some companies are developing facial recognition software to scan the faces in crowds and assess threats, specifically mentioning doubt and anger as emotions that indicate threats.  This study provides evidence that facial recognition software interprets emotions differently based on the person’s race. Using a publically available data set of professional basketball players’ pictures, I compare the emotional analysis from two different facial recognition services, Face   and Microsoft's Face API. Both services interpret black players as having more negative emotions than white players; however, there are two different mechanisms. Face   consistently interprets black players as angrier than white players, even controlling for their degree of smiling. Microsoft registers contempt instead of anger, and it interprets black players as more contemptuous when their facial expressions are ambiguous. As the players’ smile widens, the disparity disappears. This finding has implications for individuals, organizations, and society, and it contributes to the growing literature of bias and/or disparate impact in AI.","2018-11-09","2021-03-16 14:12:55","2021-04-06 15:05:45","2021-03-16 14:12:55","","","","","","","","","","","","Social Science Research Network","Rochester, NY","en","","SSRN Scholarly Paper","","","papers.ssrn.com","","DOI: 10.2139/ssrn.3281765","<div data-schema-version=""1""><p>Annotation</p> <p>Racial influence on expression recognition</p></div>","C:\Users\smczx\Zotero\storage\LJCMBRU6\papers.html; F:\Google Drive - Monash\Bibliography\Rhue_2018_Racial Influence on Automated Perceptions of Emotions.pdf","","Unreviewed","artificial intelligence; bias; coarsened exact matching; econometrics; facial recognition; race","","","","","","","","","","","","","","","","","","","ID 3281765","","","","","","","","","","","","","","","","","","","","","","","","","","",""
"9ZHFBZTZ","conferencePaper","2011","Rudovic, O.; Pantic, M.","Shape-constrained Gaussian process regression for facial-point-based head-pose normalization","2011 International Conference on Computer Vision","","","10.1109/ICCV.2011.6126407","","Given the facial points extracted from an image of a face in an arbitrary pose, the goal of facial-point-based head-pose normalization is to obtain the corresponding facial points in a predefined pose (e.g., frontal). This involves inference of complex and high-dimensional mappings due to the large number of the facial points employed, and due to differences in head-pose and facial expression. Most regression-based approaches for learning such mappings focus on modeling correlations only between the inputs (i.e., the facial points in a non-frontal pose) and the outputs (i.e., the facial points in the frontal pose), but not within the inputs and the outputs of the model. This makes these models prone to errors due to noise and outliers in test data, often resulting in anatomically impossible facial configurations formed by their predictions. To address this, we propose Shape-constrained Gaussian Process (SC-GP) regression for facial-point-based head-pose normalization. Specifically, a deformable face-shape model is used to learn a face-shape prior, which is placed on both the input and the output of GP regression in order to constrain the model predictions to anatomically feasible facial configurations. Our extensive experiments on both synthetic and real image data show that the proposed approach generalizes well across poses and handles successfully noise and outliers in test data. In addition, the proposed model outperforms previously proposed approaches to facial-point-based head-pose normalization.","2011-11","2021-03-16 14:14:23","2021-04-06 15:01:43","","1495-1502","","","","","","","","","","","","","","","","","","IEEE Xplore","","ISSN: 2380-7504","<div data-schema-version=""1""><p>Annotation</p> <p>Gaussian process regression and apply PCA to manipulate</p></div>","C:\Users\smczx\Zotero\storage\T82G2MK8\6126407.html; F:\Google Drive - Monash\Bibliography\Rudovic_Pantic_2011_Shape-constrained Gaussian process regression for facial-point-based head-pose.pdf","","Unreviewed","Principal component analysis; Deformable models; arbitrary pose; Computational modeling; Data models; deformable face-shape model; face recognition; facial point extraction; facial-point-based head-pose normalization; feature extraction; Gaussian processes; high-dimensional mappings; pose estimation; regression analysis; Shape; shape-constrained Gaussian process regression; Three dimensional displays; Training","","","","","","","","","","","","","","","","","","","","","","","","","","","","","","","2011 International Conference on Computer Vision","","","","","","","","","","","","","","",""
"9LTVQVP7","journalArticle","2019","Li, S.; Deng, W.","Reliable Crowdsourcing and Deep Locality-Preserving Learning for Unconstrained Facial Expression Recognition","IEEE Transactions on Image Processing","","1941-0042","10.1109/TIP.2018.2868382","","Facial expression is central to human experience, but most previous databases and studies are limited to posed facial behavior under controlled conditions. In this paper, we present a novel facial expression database, Real-world Affective Face Database (RAF-DB), which contains approximately 30 000 facial images with uncontrolled poses and illumination from thousands of individuals of diverse ages and races. During the crowdsourcing annotation, each image is independently labeled by approximately 40 annotators. An expectation-maximization algorithm is developed to reliably estimate the emotion labels, which reveals that real-world faces often express compound or even mixture emotions. A cross-database study between RAF-DB and CK+ database further indicates that the action units of real-world emotions are much more diverse than, or even deviate from, those of laboratory-controlled emotions. To address the recognition of multi-modal expressions in the wild, we propose a new deep locality-preserving convolutional neural network (DLP-CNN) method that aims to enhance the discriminative power of deep features by preserving the locality closeness while maximizing the inter-class scatter. Benchmark experiments on 7-class basic expressions and 11-class compound expressions, as well as additional experiments on CK+, MMI, and SFEW 2.0 databases, show that the proposed DLP-CNN outperforms the state-of-the-art handcrafted features and deep learning-based methods for expression recognition in the wild. To promote further study, we have made the RAF database, benchmarks, and descriptor encodings publicly available to the research community.","2019-01","2021-03-16 14:16:39","2021-04-06 15:06:02","","356-370","","1","28","","","","","","","","","","","","","","","IEEE Xplore","","Conference Name: IEEE Transactions on Image Processing","<div data-schema-version=""1""><p>Annotation</p> <p>RAF-DB</p></div>","F:\Google Drive - Monash\Bibliography\Li_Deng_2019_Reliable Crowdsourcing and Deep Locality-Preserving Learning for Unconstrained.pdf","","Unreviewed","convolution; Machine learning; learning (artificial intelligence); face recognition; basic emotion; CK+ database; compound emotion; Compounds; cross-database study; crowdsourcing annotation; Databases; deep learning; deep learning-based methods; deep locality-preserving convolutional neural network method; descriptor encodings; DLP-CNN; emotion labels; emotion recognition; expectation-maximisation algorithm; expectation-maximization algorithm; express compound; Expression recognition; Face; Face recognition; facial behavior posed; facial expression database; facial images; feedforward neural nets; inter-class scatter; laboratory-controlled emotions; locality closeness; mixture emotions; multimodal expressions recognition; RAF database; RAF-DB; Reactive power; real-world affective face database; real-world emotions; Reliability; unconstrained facial expression recognition; visual databases","","","","","","","","","","","","","","","","","","","","","","","","","","","","","","","","","","","","","","","","","","","","","",""
"Q7ZNACBK","journalArticle","2015","Simonyan, Karen; Zisserman, Andrew","Very Deep Convolutional Networks for Large-Scale Image Recognition","arXiv:1409.1556 [cs]","","","","http://arxiv.org/abs/1409.1556","In this work we investigate the effect of the convolutional network depth on its accuracy in the large-scale image recognition setting. Our main contribution is a thorough evaluation of networks of increasing depth using an architecture with very small (3x3) convolution filters, which shows that a significant improvement on the prior-art configurations can be achieved by pushing the depth to 16-19 weight layers. These findings were the basis of our ImageNet Challenge 2014 submission, where our team secured the first and the second places in the localisation and classification tracks respectively. We also show that our representations generalise well to other datasets, where they achieve state-of-the-art results. We have made our two best-performing ConvNet models publicly available to facilitate further research on the use of deep visual representations in computer vision.","2015-04-10","2021-03-16 14:24:33","2021-04-08 07:19:57","2021-03-16 14:24:33","","","","","","","","","","","","","","","","","","","arXiv.org","","arXiv: 1409.1556","<div data-schema-version=""1""><p>Annotation</p> <p>VGG</p> <p>Improve the previous CNN structure for better accuracy for ILSVRC.</p> <p>The depth of the structure of CNN can be discussed for better performance of the model.</p> <p>They proposed two best VGG-16 and VGG-19 structures. Instead of using big kernel size, the VGG only use 3x3 kernel sizes and 16 layers or 19 layers.</p> <p>ILSVRC-2014</p> <p>The metric is test set classification error. Their score is better than the best of ILSVRC-2013.</p> <p>+ve: More depth is beneficial for the performance. VGG structures has widely usage for other tasks.</p> <p>-ve:</p> <p>Provide a famous VGG structure for CNN area, which indicates the depth contributes more than width of CNN.</p></div>","F:\Google Drive - Monash\Bibliography\Simonyan_Zisserman_2015_Very Deep Convolutional Networks for Large-Scale Image Recognition.pdf; C:\Users\smczx\Zotero\storage\9VVQ6FR8\1409.html","","","Computer Science - Computer Vision and Pattern Recognition","","","","","","","","","","","","","","","","","","","","","","","","","","","","","","","","","","","","","","","","","","","","","",""
"CGZ5ML22","conferencePaper","2016","He, Kaiming; Zhang, Xiangyu; Ren, Shaoqing; Sun, Jian","Deep Residual Learning for Image Recognition","Proceedings of the IEEE Conference on Computer Vision and Pattern Recognition","","","","https://openaccess.thecvf.com/content_cvpr_2016/html/He_Deep_Residual_Learning_CVPR_2016_paper.html","Deeper neural networks are more difficult to train. We present a residual learning framework to ease the training of networks that are substantially deeper than those used previously. We explicitly reformulate the layers as learning residual functions with reference to the layer inputs, instead of learning unreferenced functions. We provide comprehensive empirical evidence showing that these residual networks are easier to optimize, and can gain accuracy from considerably increased depth. On the ImageNet dataset we evaluate residual nets with a depth of up to 152 layers---8x deeper than VGG nets but still having lower complexity. An ensemble of these residual nets achieves 3.57% error on the ImageNet test set. This result won the 1st place on the ILSVRC 2015 classification task. We also present analysis on CIFAR-10 with 100 and 1000 layers. The depth of representations is of central importance for many visual recognition tasks. Solely due to our extremely deep representations, we obtain a 28% relative improvement on the COCO object detection dataset. Deep residual nets are foundations of our submissions to ILSVRC & COCO 2015 competitions, where we also won the 1st places on the tasks of ImageNet detection, ImageNet localization, COCO detection, and COCO segmentation.","2016","2021-03-16 14:25:33","2021-04-06 15:05:00","2021-03-16 14:25:33","770-778","","","","","","","","","","","","","","","","","","openaccess.thecvf.com","","","<div data-schema-version=""1""><p>Annotation</p> <p>ResNet</p></div>","F:\Google Drive - Monash\Bibliography\He et al_2016_Deep Residual Learning for Image Recognition.pdf","","Unreviewed","","","","","","","","","","","","","","","","","","","","","","","","","","","","","","","","Proceedings of the IEEE Conference on Computer Vision and Pattern Recognition","","","","","","","","","","","","","","",""
"5DX7TJDY","journalArticle","2014","Lin, Min; Chen, Qiang; Yan, Shuicheng","Network In Network","arXiv:1312.4400 [cs]","","","","http://arxiv.org/abs/1312.4400","We propose a novel deep network structure called ""Network In Network"" (NIN) to enhance model discriminability for local patches within the receptive field. The conventional convolutional layer uses linear filters followed by a nonlinear activation function to scan the input. Instead, we build micro neural networks with more complex structures to abstract the data within the receptive field. We instantiate the micro neural network with a multilayer perceptron, which is a potent function approximator. The feature maps are obtained by sliding the micro networks over the input in a similar manner as CNN; they are then fed into the next layer. Deep NIN can be implemented by stacking mutiple of the above described structure. With enhanced local modeling via the micro network, we are able to utilize global average pooling over feature maps in the classification layer, which is easier to interpret and less prone to overfitting than traditional fully connected layers. We demonstrated the state-of-the-art classification performances with NIN on CIFAR-10 and CIFAR-100, and reasonable performances on SVHN and MNIST datasets.","2014-03-04","2021-03-16 14:27:20","2021-04-08 06:08:21","2021-03-16 14:27:20","","","","","","","","","","","","","","","","","","","arXiv.org","","arXiv: 1312.4400","<div data-schema-version=""1""><p>Annotation</p> <p>NIN</p> <p>The traditional convolutional layer as generalized linear model (GLM) has low level of abstraction.</p> <p>By replacing the GLM in convolutional layer with a non-linear function approximator can improve the &nbsp;abstraction ability of local model.</p> <p>The authors proposed two concepts, using MLP to replace the GLM in convolutional layer, and the usage of global average pooling layer. They use convolution layers with 1x1 kernel to simulate the MLP inside. And the global average pooling layer is used to replace the fully-connected layers in traditional CNN.</p> <p>CIFAR-10, CIFAR-100, SVHN, MNIST.</p> <p>The metric is test set classification error. In these 4 datasets, the NIN has an outstanding performance compared to other structures. Also the global average pooling as a regularizer is also better than fully connected + dropout set.</p> <p>+ve: The Mlpconv allows more complex and learnable interaction of cross channel information. Global average pooling is more meaningful and interpretable. Global average pooling is more robust to spatial translations of the input.</p> <p>-ve:</p> <p>The ideas in this paper is amazing, and many famous structures such as ResNet and GoogLeNet use these ideas.</p> <p></p></div>; Comment: 10 pages, 4 figures, for iclr2014","F:\Google Drive - Monash\Bibliography\Lin et al_2014_Network In Network.pdf; C:\Users\smczx\Zotero\storage\GBJXNLGT\1312.html","","","Computer Science - Machine Learning; Computer Science - Computer Vision and Pattern Recognition; Computer Science - Neural and Evolutionary Computing","","","","","","","","","","","","","","","","","","","","","","","","","","","","","","","","","","","","","","","","","","","","","",""
