"CQEVWNAP","conferencePaper","2015","Szegedy, Christian; Liu, Wei; Jia, Yangqing; Sermanet, Pierre; Reed, Scott; Anguelov, Dragomir; Erhan, Dumitru; Vanhoucke, Vincent; Rabinovich, Andrew","Going Deeper With Convolutions","Proceedings of the IEEE Conference on Computer Vision and Pattern Recognition","","","","https://www.cv-foundation.org/openaccess/content_cvpr_2015/html/Szegedy_Going_Deeper_With_2015_CVPR_paper.html","We propose a deep convolutional neural network architecture codenamed Inception that achieves the new state of the art for classification and detection in the ImageNet Large-Scale Visual Recognition Challenge 2014 (ILSVRC2014). The main hallmark of this architecture is the improved utilization of the computing resources inside the network. By a carefully crafted design, we increased the depth and width of the network while keeping the computational budget constant. To optimize quality, the architectural decisions were based on the Hebbian principle and the intuition of multi-scale processing. One particular incarnation of this architecture, GoogLeNet, a 22 layers deep network, was used to assess its quality in the context of object detection and classification.","2015","2021-03-16 14:27:59","2021-04-08 09:13:54","2021-03-16 14:27:59","1-9","","","","","","","","","","","","","","","","","","www.cv-foundation.org","","","<div data-schema-version=""1""><p>Annotation</p> <p>Inception Module and GoogLeNet (InceptionV1)</p> <p>The mobile and embedded computting has limited power for models. A high-efficiency method is required.</p> <p>Decide to develop a high-efficiency method keeping a computational budget of 1.5 billion operations.</p> <p>The Inception module has multiple routes for input features. Each route has different kernel size of convolutions and max-pooling. And then, concatenate the outputs as the result of this module. Otherwise, the 1x1 convolutions can be used to reduce the number of channels. GoogLeNet is the model formed by Inception modules.</p> <p>ILSVRC 2014</p> <p>The metric is Top-5 error in ILSVRC 2014. The GoogLeNet ranked 1st in this competition.</p> <p>+ve: A significant quality improvement with slightly increase of computational requirements. Also available for object detection.</p> <p>-ve:</p> <p>The Inception Module is the new direction that the CNN can be not sequence. And, the high-efficiency also is an important metrics to judge the usability of a neural network structure.</p></div>","C:\Users\smczx\Zotero\storage\PTFRKBPB\Szegedy_Going_Deeper_With_2015_CVPR_paper.html; F:\Google Drive - Monash\Bibliography\Szegedy et al_2015_Going Deeper With Convolutions.pdf","","","","","","","","","","","","","","","","","","","","","","","","","","","","","","","","","","Proceedings of the IEEE Conference on Computer Vision and Pattern Recognition","","","","","","","","","","","","","","",""
"Y99BNDVT","journalArticle","2012","Krizhevsky, Alex; Sutskever, Ilya; Hinton, Geoffrey","ImageNet Classification with Deep Convolutional Neural Networks","Advances in neural information processing systems","","","10.1145/3065386","","We trained a large, deep convolutional neural network to classify the 1.2 million high-resolution images in the ImageNet LSVRC-2010 contest into the 1000 dif-ferent classes. On the test data, we achieved top-1 and top-5 error rates of 37.5% and 17.0% which is considerably better than the previous state-of-the-art. The neural network, which has 60 million parameters and 650,000 neurons, consists of five convolutional layers, some of which are followed by max-pooling layers, and three fully-connected layers with a final 1000-way softmax. To make train-ing faster, we used non-saturating neurons and a very efficient GPU implemen-tation of the convolution operation. To reduce overfitting in the fully-connected layers we employed a recently-developed regularization method called ""dropout"" that proved to be very effective. We also entered a variant of this model in the ILSVRC-2012 competition and achieved a winning top-5 test error rate of 15.3%, compared to 26.2% achieved by the second-best entry.","2012-01-01","2021-03-16 14:39:49","2021-04-06 15:04:35","","1097–1105","","","25","","Neural Information Processing Systems","","","","","","","","","","","","","ResearchGate","","","<div data-schema-version=""2""><p>Annotation</p> <p>AlexNet / ReLU</p></div>","; F:\Google Drive - Monash\Bibliography\Krizhevsky et al_2012_ImageNet Classification with Deep Convolutional Neural Networks.pdf","https://www.researchgate.net/publication/267960550_ImageNet_Classification_with_Deep_Convolutional_Neural_Networks","Unreviewed","","","","","","","","","","","","","","","","","","","","","","","","","","","","","","","","","","","","","","","","","","","","","","",""
"7T2LWIMS","conferencePaper","2020","Pidhorskyi, Stanislav; Adjeroh, Donald A.; Doretto, Gianfranco","Adversarial Latent Autoencoders","Proceedings of the IEEE/CVF Conference on Computer Vision and Pattern Recognition","","","","https://openaccess.thecvf.com/content_CVPR_2020/html/Pidhorskyi_Adversarial_Latent_Autoencoders_CVPR_2020_paper.html","Autoencoder networks are unsupervised approaches aiming at combining generative and representational properties by learning simultaneously an encoder-generator map. Although studied extensively, the issues of whether they have the same generative power of GANs, or learn disentangled representations, have not been fully addressed. We introduce an autoencoder that tackles these issues jointly, which we call Adversarial Latent Autoencoder (ALAE). It is a general architecture that can leverage recent improvements on GAN training procedures. We designed two autoencoders: one based on a MLP encoder, and another based on a StyleGAN generator, which we call StyleALAE. We verify the disentanglement properties of both architectures. We show that StyleALAE can not only generate 1024x1024 face images with comparable quality of StyleGAN, but at the same resolution can also produce face reconstructions and manipulations based on real images. This makes ALAE the first autoencoder able to compare with, and go beyond the capabilities of a generator-only type of architecture.","2020","2021-03-16 14:44:03","2021-04-06 15:06:27","2021-03-16 14:44:03","14104-14113","","","","","","","","","","","","","","","","","","openaccess.thecvf.com","","","","C:\Users\smczx\Zotero\storage\8TBAEC8L\Pidhorskyi_Adversarial_Latent_Autoencoders_CVPR_2020_paper.html; F:\Google Drive - Monash\Bibliography\Pidhorskyi et al_2020_Adversarial Latent Autoencoders.pdf","","Unreviewed","","","","","","","","","","","","","","","","","","","","","","","","","","","","","","","","Proceedings of the IEEE/CVF Conference on Computer Vision and Pattern Recognition","","","","","","","","","","","","","","",""
"ZS3LF4TU","journalArticle","2017","Arjovsky, Martin; Chintala, Soumith; Bottou, Léon","Wasserstein GAN","arXiv:1701.07875 [cs, stat]","","","","http://arxiv.org/abs/1701.07875","We introduce a new algorithm named WGAN, an alternative to traditional GAN training. In this new model, we show that we can improve the stability of learning, get rid of problems like mode collapse, and provide meaningful learning curves useful for debugging and hyperparameter searches. Furthermore, we show that the corresponding optimization problem is sound, and provide extensive theoretical work highlighting the deep connections to other distances between distributions.","2017-12-06","2021-03-16 14:44:26","2021-04-06 15:05:33","2021-03-16 14:44:26","","","","","","","","","","","","","","","","","","","arXiv.org","","arXiv: 1701.07875","<div data-schema-version=""1""><p>Annotation</p> <p>WGAN</p></div>","F:\Google Drive - Monash\Bibliography\Arjovsky et al_2017_Wasserstein GAN.pdf; C:\Users\smczx\Zotero\storage\PWZ8UTT5\1701.html","","Unreviewed","Computer Science - Machine Learning; Statistics - Machine Learning","","","","","","","","","","","","","","","","","","","","","","","","","","","","","","","","","","","","","","","","","","","","","",""
"ZMPBRIPK","journalArticle","2020","Zheng, Xin; Guo, Yanqing; Huang, Huaibo; Li, Yi; He, Ran","A Survey of Deep Facial Attribute Analysis","International Journal of Computer Vision","","1573-1405","10.1007/s11263-020-01308-z","https://doi.org/10.1007/s11263-020-01308-z","Facial attribute analysis has received considerable attention when deep learning techniques made remarkable breakthroughs in this field over the past few years. Deep learning based facial attribute analysis consists of two basic sub-issues: facial attribute estimation (FAE), which recognizes whether facial attributes are present in given images, and facial attribute manipulation (FAM), which synthesizes or removes desired facial attributes. In this paper, we provide a comprehensive survey of deep facial attribute analysis from the perspectives of both estimation and manipulation. First, we summarize a general pipeline that deep facial attribute analysis follows, which comprises two stages: data preprocessing and model construction. Additionally, we introduce the underlying theories of this two-stage pipeline for both FAE and FAM. Second, the datasets and performance metrics commonly used in facial attribute analysis are presented. Third, we create a taxonomy of state-of-the-art methods and review deep FAE and FAM algorithms in detail. Furthermore, several additional facial attribute related issues are introduced, as well as relevant real-world applications. Finally, we discuss possible challenges and promising future research directions.","2020-09-01","2021-03-16 14:46:55","2021-04-06 15:06:45","2021-03-16 14:46:55","2002-2034","","8","128","","Int J Comput Vis","","","","","","","","en","","","","","Springer Link","","","<div data-schema-version=""2""><p>Annotation</p> <p>Introduction to all facial analysis</p></div>","F:\Google Drive - Monash\Bibliography\Zheng et al_2020_A Survey of Deep Facial Attribute Analysis.pdf","","Unreviewed","","","","","","","","","","","","","","","","","","","","","","","","","","","","","","","","","","","","","","","","","","","","","","",""
"RNGWI5TW","journalArticle","2016","Radford, Alec; Metz, Luke; Chintala, Soumith","Unsupervised Representation Learning with Deep Convolutional Generative Adversarial Networks","arXiv:1511.06434 [cs]","","","","http://arxiv.org/abs/1511.06434","In recent years, supervised learning with convolutional networks (CNNs) has seen huge adoption in computer vision applications. Comparatively, unsupervised learning with CNNs has received less attention. In this work we hope to help bridge the gap between the success of CNNs for supervised learning and unsupervised learning. We introduce a class of CNNs called deep convolutional generative adversarial networks (DCGANs), that have certain architectural constraints, and demonstrate that they are a strong candidate for unsupervised learning. Training on various image datasets, we show convincing evidence that our deep convolutional adversarial pair learns a hierarchy of representations from object parts to scenes in both the generator and discriminator. Additionally, we use the learned features for novel tasks - demonstrating their applicability as general image representations.","2016-01-07","2021-03-16 14:49:34","2021-04-06 15:05:28","2021-03-16 14:49:34","","","","","","","","","","","","","","","","","","","arXiv.org","","arXiv: 1511.06434","<div data-schema-version=""1""><p>Annotation</p> <p>DCGAN</p></div>; Comment: Under review as a conference paper at ICLR 2016","F:\Google Drive - Monash\Bibliography\Radford et al_2016_Unsupervised Representation Learning with Deep Convolutional Generative.pdf; C:\Users\smczx\Zotero\storage\DQWLAZHB\1511.html","","Unreviewed","Computer Science - Machine Learning; Computer Science - Computer Vision and Pattern Recognition","","","","","","","","","","","","","","","","","","","","","","","","","","","","","","","","","","","","","","","","","","","","","",""
"BTCMR42I","conferencePaper","2015","Ioffe, Sergey; Szegedy, Christian","Batch Normalization: Accelerating Deep Network Training by Reducing Internal Covariate Shift","International Conference on Machine Learning","","","","http://proceedings.mlr.press/v37/ioffe15.html","Training Deep Neural Networks is complicated by the fact that the distribution of each layer’s inputs changes during training, as the parameters of the previous layers change. This slows down the t...","2015-06-01","2021-03-16 14:50:26","2021-04-06 15:04:50","2021-03-16 14:50:26","448-456","","","","","","Batch Normalization","","","","","PMLR","","en","","","","","proceedings.mlr.press","","ISSN: 1938-7228","<div data-schema-version=""1""><p>Annotation</p> <p>Batch normalization and InceptionV2</p> <p></p></div>","C:\Users\smczx\Zotero\storage\T2BGYQWB\ioffe15.html; F:\Google Drive - Monash\Bibliography\Ioffe_Szegedy_2015_Batch Normalization.pdf","","Unreviewed","","","","","","","","","","","","","","","","","","","","","","","","","","","","","","","","International Conference on Machine Learning","","","","","","","","","","","","","","",""
"VP88VTAW","conferencePaper","2020","Mildenhall, Ben; Srinivasan, Pratul; Tancik, Matthew; Barron, Jonathan; Ramamoorthi, Ravi; Ng, Ren","NeRF: Representing Scenes as Neural Radiance Fields for View Synthesis","European Conference on Computer Vision","978-3-030-58451-1","","10.1007","","We present a method that achieves state-of-the-art results for synthesizing novel views of complex scenes by optimizing an underlying continuous volumetric scene function using a sparse set of input views. Our algorithm represents a scene using a fully-connected (non-convolutional) deep network, whose input is a single continuous 5D coordinate (spatial location (x,y,z) and viewing direction (θ,ϕ)) and whose output is the volume density and view-dependent emitted radiance at that spatial location. We synthesize views by querying 5D coordinates along camera rays and use classic volume rendering techniques to project the output colors and densities into an image. Because volume rendering is naturally differentiable, the only input required to optimize our representation is a set of images with known camera poses. We describe how to effectively optimize neural radiance fields to render photorealistic novel views of scenes with complicated geometry and appearance, and demonstrate results that outperform prior work on neural rendering and view synthesis. View synthesis results are best viewed as videos, so we urge readers to view our supplementary video for convincing comparisons.","2020","2021-03-16 14:54:40","2021-03-16 15:32:14","","405-421","","","","","","","","","","","","Springer, Cham","","","","","","","","DOI: 10.1007/978-3-030-58452-8_24","","F:\Google Drive - Monash\Bibliography\Mildenhall et al_2020_NeRF.pdf","","Unread","","","","","","","","","","","","","","","","","","","","","","","","","","","","","","","","European Conference on Computer Vision","","","","","","","","","","","","","","",""
"C3G62U2M","journalArticle","2020","Pumarola, Albert; Corona, Enric; Pons-Moll, Gerard; Moreno-Noguer, Francesc","D-NeRF: Neural Radiance Fields for Dynamic Scenes","arXiv:2011.13961 [cs]","","","","http://arxiv.org/abs/2011.13961","Neural rendering techniques combining machine learning with geometric reasoning have arisen as one of the most promising approaches for synthesizing novel views of a scene from a sparse set of images. Among these, stands out the Neural radiance fields (NeRF), which trains a deep network to map 5D input coordinates (representing spatial location and viewing direction) into a volume density and view-dependent emitted radiance. However, despite achieving an unprecedented level of photorealism on the generated images, NeRF is only applicable to static scenes, where the same spatial location can be queried from different images. In this paper we introduce D-NeRF, a method that extends neural radiance fields to a dynamic domain, allowing to reconstruct and render novel images of objects under rigid and non-rigid motions from a \emph{single} camera moving around the scene. For this purpose we consider time as an additional input to the system, and split the learning process in two main stages: one that encodes the scene into a canonical space and another that maps this canonical representation into the deformed scene at a particular time. Both mappings are simultaneously learned using fully-connected networks. Once the networks are trained, D-NeRF can render novel images, controlling both the camera view and the time variable, and thus, the object movement. We demonstrate the effectiveness of our approach on scenes with objects under rigid, articulated and non-rigid motions. Code, model weights and the dynamic scenes dataset will be released.","2020-11-27","2021-03-16 14:59:24","2021-03-16 15:32:20","2021-03-16 14:59:24","","","","","","","D-NeRF","","","","","","","","","","","","arXiv.org","","arXiv: 2011.13961","","F:\Google Drive - Monash\Bibliography\Pumarola et al_2020_D-NeRF.pdf; C:\Users\smczx\Zotero\storage\4M84DPVT\2011.html","","Unread","Computer Science - Computer Vision and Pattern Recognition","","","","","","","","","","","","","","","","","","","","","","","","","","","","","","","","","","","","","","","","","","","","","",""
"HLLHIHTD","conferencePaper","2016","Johnson, Justin; Alahi, Alexandre; Fei-Fei, Li","Perceptual Losses for Real-Time Style Transfer and Super-Resolution","Computer Vision – ECCV 2016","978-3-319-46475-6","","10.1007/978-3-319-46475-6_43","","We consider image transformation problems, where an input image is transformed into an output image. Recent methods for such problems typically train feed-forward convolutional neural networks using a per-pixel loss between the output and ground-truth images. Parallel work has shown that high-quality images can be generated by defining and optimizing perceptual loss functions based on high-level features extracted from pretrained networks. We combine the benefits of both approaches, and propose the use of perceptual loss functions for training feed-forward networks for image transformation tasks. We show results on image style transfer, where a feed-forward network is trained to solve the optimization problem proposed by Gatys et al. in real-time. Compared to the optimization-based method, our network gives similar qualitative results but is three orders of magnitude faster. We also experiment with single-image super-resolution, where replacing a per-pixel loss with a perceptual loss gives visually pleasing results.","2016","2021-03-18 05:21:38","2021-04-06 15:05:03","","694-711","","","","","","","Lecture Notes in Computer Science","","","","Springer International Publishing","Cham","en","","","","","Springer Link","","","<div data-schema-version=""1""><p>Annotation</p> <p>Perceptual loss is the difference (MSE) between features of hidden layers in loss network from y_true and y_pred.</p></div>","F:\Google Drive - Monash\Bibliography\Johnson et al_2016_Perceptual Losses for Real-Time Style Transfer and Super-Resolution.pdf","","Unreviewed","Deep learning; Style transfer; Super-resolution","Leibe, Bastian; Matas, Jiri; Sebe, Nicu; Welling, Max","","","","","","","","","","","","","","","","","","","","","","","","","","","","","","","","","","","","","","","","","","","","",""
"HCKMHJ8W","conferencePaper","2020","Hong, Ming; Xie, Yuan; Li, Cuihua; Qu, Yanyun","Distilling Image Dehazing With Heterogeneous Task Imitation","Proceedings of the IEEE/CVF Conference on Computer Vision and Pattern Recognition","","","","https://openaccess.thecvf.com/content_CVPR_2020/html/Hong_Distilling_Image_Dehazing_With_Heterogeneous_Task_Imitation_CVPR_2020_paper.html","","2020","2021-03-18 05:07:28","2021-04-06 15:06:16","2021-03-18 05:07:28","3462-3471","","","","","","","","","","","","","","","","","","openaccess.thecvf.com","","","<div data-schema-version=""1""><p>Annotation</p> <p>Using knowledge distillation and an autoencoder teacher to train a dehazing network with representation mimicking loss.</p></div>","F:\Google Drive - Monash\Bibliography\Hong et al_2020_Distilling Image Dehazing With Heterogeneous Task Imitation.pdf; C:\Users\smczx\Zotero\storage\ABU8RUMW\Hong_Distilling_Image_Dehazing_With_Heterogeneous_Task_Imitation_CVPR_2020_paper.html","","Unreviewed","","","","","","","","","","","","","","","","","","","","","","","","","","","","","","","","Proceedings of the IEEE/CVF Conference on Computer Vision and Pattern Recognition","","","","","","","","","","","","","","",""
"YEH4KREU","conferencePaper","2019","Gao, Qinquan; Zhao, Yan; Li, Gen; Tong, Tong","Image Super-Resolution Using Knowledge Distillation","Computer Vision – ACCV 2018","978-3-030-20890-5","","10.1007/978-3-030-20890-5_34","","The significant improvements in image super-resolution (SR) in recent years is majorly resulted from the use of deeper and deeper convolutional neural networks (CNN). However, both computational time and memory consumption simultaneously increase with the utilization of very deep CNN models, posing challenges to deploy SR models in realtime on computationally limited devices. In this work, we propose a novel strategy that uses a teacher-student network to improve the image SR performance. The training of a small but efficient student network is guided by a deep and powerful teacher network. We have evaluated the performance using different ways of knowledge distillation. Through the validations on four datasets, the proposed method significantly improves the SR performance of a student network without changing its structure. This means that the computational time and the memory consumption do not increase during the testing stage while the SR performance is significantly improved.","2019","2021-03-18 05:04:35","2021-04-06 15:05:55","","527-541","","","","","","","Lecture Notes in Computer Science","","","","Springer International Publishing","Cham","en","","","","","Springer Link","","","<div data-schema-version=""1""><p>Annotation</p> <p>Perform super resolution with knowledge distillation.</p></div>","F:\Google Drive - Monash\Bibliography\Gao et al_2019_Image Super-Resolution Using Knowledge Distillation.pdf","","Unreviewed","Super-resolution; Convolutional neural networks; Knowledge distillation; Teacher-student network","Jawahar, C. V.; Li, Hongdong; Mori, Greg; Schindler, Konrad","","","","","","","","","","","","","","","","","","","","","","","","","","","","","","","","","","","","","","","","","","","","",""
"94Q7XD2W","conferencePaper","2018","Woo, Sanghyun; Park, Jongchan; Lee, Joon-Young; Kweon, In So","CBAM: Convolutional Block Attention Module","Proceedings of the European Conference on Computer Vision (ECCV)","","","","https://openaccess.thecvf.com/content_ECCV_2018/html/Sanghyun_Woo_Convolutional_Block_Attention_ECCV_2018_paper.html","","2018","2021-03-18 03:50:54","2021-04-06 15:05:47","2021-03-18 03:50:54","3-19","","","","","","CBAM","","","","","","","","","","","","openaccess.thecvf.com","","","<div data-schema-version=""1""><p>Annotation</p> <p>With Channel Attention Module and Spatial Attention Module, the CBAM can be inserted into conv blocks to improve the CNN performance.</p></div>","F:\Google Drive - Monash\Bibliography\Woo et al_2018_CBAM.pdf; C:\Users\smczx\Zotero\storage\JEERU7SI\Sanghyun_Woo_Convolutional_Block_Attention_ECCV_2018_paper.html","","Unreviewed","","","","","","","","","","","","","","","","","","","","","","","","","","","","","","","","Proceedings of the European Conference on Computer Vision (ECCV)","","","","","","","","","","","","","","",""
